{
  "feature_id": "001-isodate-cli",
  "product_name": "isodate CLI",
  "vision_ref": "planning/preeng-unix/001-isodate-cli/vision.md",
  "generated_by": "unix.decompose",
  "verifier_vocabulary": [
    "software-test",
    "manual-only"
  ],
  "nodes": [
    {
      "id": "C-000",
      "path": "isodate-cli",
      "name": "isodate CLI (whole product)",
      "tier_label": "product",
      "depth": 0,
      "parent": null,
      "children": [
        "C-001",
        "C-002",
        "C-003"
      ],
      "purpose": "The complete single-file command-line tool isodate.py. Wires argv -> arg parser -> clock -> formatter -> stdout, returning the correct exit code. End-to-end embodiment of the vision.",
      "single_responsibility": "Print the requested date/time line to stdout and return the correct exit code for the given argv.",
      "output_artifact": {
        "kind": "software",
        "description": "An executable Python file build/isodate.py. Running `python3 build/isodate.py [flags]` prints one line and exits 0; bad flags print usage to stderr and exit non-zero.",
        "location_hint": "planning/preeng-unix/001-isodate-cli/build/isodate.py"
      },
      "contract": {
        "inputs": [
          {
            "name": "argv",
            "type": "list[str]",
            "description": "Command-line arguments (sys.argv[1:])."
          },
          {
            "name": "parsed_flags",
            "type": "Namespace{utc:bool,time:bool}",
            "description": "Result of parsing argv.",
            "from_component": "C-003"
          },
          {
            "name": "now",
            "type": "datetime (tz-aware or local)",
            "description": "The current instant from the clock provider.",
            "from_component": "C-001"
          },
          {
            "name": "rendered_line",
            "type": "str",
            "description": "Formatted date/time string ready to print.",
            "from_component": "C-002"
          }
        ],
        "outputs": [
          {
            "name": "stdout_line",
            "type": "str",
            "description": "The single date/time line printed on success."
          },
          {
            "name": "exit_code",
            "type": "int",
            "description": "0 on success; non-zero (argparse: 2) on bad flags."
          }
        ],
        "connects_to_parent_via": "This IS the root. Its composed output (stdout line + exit code) is the product the vision asks for; the CLI main() function assembles C-003 (parse), C-001 (clock), C-002 (format), then prints."
      },
      "verifier": {
        "type": "software-test",
        "auto_check": {
          "runnable": true,
          "method": "PYTHONPATH=planning/preeng-unix/001-isodate-cli/build/tests python3 -m unittest test_isodate.EndToEndTests",
          "expected": "End-to-end tests pass: default prints YYYY-MM-DD exit 0; --time and --utc --time append HH:MM:SS; --bogus exits non-zero with usage on stderr."
        },
        "human_test": {
          "procedure": [
            "From the repo root run: python3 planning/preeng-unix/001-isodate-cli/build/isodate.py",
            "Run: python3 planning/preeng-unix/001-isodate-cli/build/isodate.py --utc --time",
            "Run: python3 planning/preeng-unix/001-isodate-cli/build/isodate.py --bogus ; echo \"exit=$?\""
          ],
          "expected_observation": "First prints today's local date as YYYY-MM-DD; second prints a UTC `YYYY-MM-DD HH:MM:SS` line; third prints a usage line to the terminal and reports a non-zero exit.",
          "pass_criteria": "All three observations hold exactly as described."
        }
      },
      "acceptance_criteria": [
        "No-flag run prints exactly one YYYY-MM-DD line and exits 0.",
        "--utc --time prints a UTC `YYYY-MM-DD HH:MM:SS` line and exits 0.",
        "A bad flag exits non-zero and writes a usage message to stderr.",
        "isodate.py imports only Python standard-library modules."
      ],
      "reuse": {
        "reusable": false,
        "tags": [
          "cli",
          "entrypoint",
          "isodate"
        ],
        "known_consumers": []
      },
      "build_order_index": 3,
      "status": "passed",
      "evidence_ref": "evidence/C-000-agent.md"
    },
    {
      "id": "C-001",
      "path": "isodate-cli/clock-provider",
      "name": "Clock provider",
      "tier_label": "part",
      "depth": 1,
      "parent": "C-000",
      "children": [],
      "purpose": "Supplies the current instant as a datetime. Accepts an optional fixed value so tests are deterministic. The single source of 'now' for the whole tool.",
      "single_responsibility": "Return the current instant as a datetime (local or UTC), honoring an injected fixed clock when provided.",
      "output_artifact": {
        "kind": "software",
        "description": "A `now(utc: bool, fixed: datetime|None)` function in build/isodate.py. Calling it with a fixed datetime returns that exact datetime; otherwise the real current instant.",
        "location_hint": "planning/preeng-unix/001-isodate-cli/build/isodate.py"
      },
      "contract": {
        "inputs": [
          {
            "name": "utc",
            "type": "bool",
            "description": "If true, return the instant in UTC; else local."
          },
          {
            "name": "fixed",
            "type": "datetime|None",
            "description": "Optional injected fixed instant for deterministic tests."
          }
        ],
        "outputs": [
          {
            "name": "now",
            "type": "datetime",
            "description": "A datetime: tz-aware UTC when utc=True, naive-local otherwise (or the injected fixed value)."
          }
        ],
        "connects_to_parent_via": "main() (C-000) calls now(utc=flags.utc) and passes the result to the formatter (C-002)."
      },
      "verifier": {
        "type": "software-test",
        "auto_check": {
          "runnable": true,
          "method": "PYTHONPATH=planning/preeng-unix/001-isodate-cli/build/tests python3 -m unittest test_isodate.ClockTests",
          "expected": "Clock tests pass: now(fixed=X) returns X; now(utc=True) returns a UTC tz-aware datetime; exit code 0."
        },
        "human_test": {
          "procedure": [
            "From repo root run: python3 -c \"import sys; sys.path.insert(0,'planning/preeng-unix/001-isodate-cli/build'); import isodate, datetime; print(isodate.now(fixed=datetime.datetime(2020,1,2,3,4,5)))\"",
            "Observe the printed datetime."
          ],
          "expected_observation": "Prints `2020-01-02 03:04:05` (the injected fixed value), proving the clock is injectable.",
          "pass_criteria": "Output equals the injected fixed datetime exactly."
        }
      },
      "acceptance_criteria": [
        "now(fixed=X) returns exactly X (determinism under injection).",
        "now(utc=True) returns a timezone-aware datetime in UTC.",
        "now(utc=False) returns the local current instant.",
        "Uses only stdlib datetime."
      ],
      "reuse": {
        "reusable": true,
        "tags": [
          "clock",
          "time-source",
          "injectable",
          "determinism"
        ],
        "known_consumers": [
          "C-002",
          "C-000"
        ]
      },
      "build_order_index": 0,
      "status": "passed",
      "evidence_ref": "evidence/C-001-agent.md"
    },
    {
      "id": "C-002",
      "path": "isodate-cli/datetime-formatter",
      "name": "Date/time formatter",
      "tier_label": "part",
      "depth": 1,
      "parent": "C-000",
      "children": [],
      "purpose": "Formats a datetime into the output string: always a YYYY-MM-DD date, optionally a space + HH:MM:SS time. Single shared formatter for default, --utc, --time and composed flags.",
      "single_responsibility": "Turn a datetime plus a with_time flag into the correct output string.",
      "output_artifact": {
        "kind": "software",
        "description": "A `format_line(dt, with_time: bool)` function in build/isodate.py returning a string like '2026-06-05' or '2026-06-05 14:03:09'.",
        "location_hint": "planning/preeng-unix/001-isodate-cli/build/isodate.py"
      },
      "contract": {
        "inputs": [
          {
            "name": "dt",
            "type": "datetime",
            "description": "The instant to format.",
            "from_component": "C-001"
          },
          {
            "name": "with_time",
            "type": "bool",
            "description": "Whether to append HH:MM:SS."
          }
        ],
        "outputs": [
          {
            "name": "line",
            "type": "str",
            "description": "YYYY-MM-DD, or YYYY-MM-DD HH:MM:SS when with_time is true."
          }
        ],
        "connects_to_parent_via": "main() (C-000) calls format_line(now, flags.time) and prints the returned string to stdout."
      },
      "verifier": {
        "type": "software-test",
        "auto_check": {
          "runnable": true,
          "method": "PYTHONPATH=planning/preeng-unix/001-isodate-cli/build/tests python3 -m unittest test_isodate.FormatterTests",
          "expected": "Formatter tests pass: date-only and date+time outputs match the expected strings for a fixed datetime; exit code 0."
        },
        "human_test": {
          "procedure": [
            "From repo root run: python3 -c \"import sys; sys.path.insert(0,'planning/preeng-unix/001-isodate-cli/build'); import isodate, datetime; dt=datetime.datetime(2026,6,5,14,3,9); print(isodate.format_line(dt, False)); print(isodate.format_line(dt, True))\"",
            "Read the two printed lines."
          ],
          "expected_observation": "Line 1 prints `2026-06-05`; line 2 prints `2026-06-05 14:03:09`.",
          "pass_criteria": "Both lines match exactly (date-only, then date + HH:MM:SS)."
        }
      },
      "acceptance_criteria": [